"";"titulo";"nome";"desc";"cargo_deleg";"org";"org_detalhe";"cargo_org";"conf";"pais";"nline";"fonte";"id_org_dupla"
"1";"Doutor";"Itamar Augusto Cautiero Franco";"Vice-Presidente da República";NA;"Vice-Presidência da República";NA;"Vice-Presidente da República";"UNCED, Conf";"Brasil";1;"LAI MRE";2738
"2";"Professor";"Celso Lafer";"Ministro de Estado das Relações Exteriores, Presidente da Comissão Interministerial para a Preparação da Conferência das Nações Unidas sobre Meio Ambiente e Desenvolvimento – CIMA";NA;"Ministério das Relações Exteriores";NA;"Ministro";"UNCED, Conf";"Brasil";2;"LAI MRE";2739
"3";"Doutor";"Célio de Oliveira Borja";"Ministro de Estado da Justiça";NA;"Ministério da Justiça";NA;NA;"UNCED, Conf";"Brasil";3;"LAI MRE";2740
"4";"Almirante-de-Esquadra";"Mário Cezar Flores";"Ministro de Estado da Marinha";NA;"Ministério da Marinha";NA;"Ministro; Almirante-de-Esquadra";"UNCED, Conf";"Brasil";4;"LAI MRE";2741
"5";"General-de-Exército";"Carlos Tinoco Ribeiro Gomes";"Ministro de Estado do Exército";NA;"Ministério do Exército";NA;"Ministro; General-de-Exército";"UNCED, Conf";"Brasil";5;"LAI MRE";2742
"6";"Embaixador";"Marcílio Marques Moreira";"Ministro de Estado da Economia, Fazenda e Planejamento";NA;"Ministério da Economia, Fazenda e Planejamento";NA;NA;"UNCED, Conf";"Brasil";6;"LAI MRE";2743
"7";"Doutor";"Antonio Cabrera Mano Filho";"Ministro de Estado da Agricultura e Reforma Agrária";NA;"Ministério da Agricultura e Reforma Agrária";NA;NA;"UNCED, Conf";"Brasil";7;"LAI MRE";2744
"8";"Professor";"José Goldemberg";"Ministro de Estado da Educação, Secretário Interino do Meio Ambiente da Presidência da República e membro da Comissão Interministerial para a Preparação da Confederação das Nações Unidas sobre Meio Ambiente e Desenvolvimento – CIMA";NA;"Ministério da Educação; Secretaria de Meio Ambiente da Presidência";NA;"Ministro; Secretário Interino da SEMA";"UNCED, Conf";"Brasil";8;"LAI MRE";2745
"9";"Tenente-Brigadeiro-do-Ar";"Sócrates da Costa Monteiro";"Ministro de Estado da Aeronáutica";NA;"Ministério da Aeronáutica";NA;"Ministro; Tenente-Brigadeiro-do-Ar";"UNCED, Conf";"Brasil";9;"LAI MRE";2746
"10";"Doutor";"Adib Jatene";"Ministro de Estado da Saúde";NA;"Ministério da Saúde";NA;"Ministro";"UNCED, Conf";"Brasil";10;"LAI MRE";2747
"11";"Doutor";"Ricardo Fiuza";"Ministro de Estado da Ação Social";NA;"Ministério da Ação Social";NA;"Ministro";"UNCED, Conf";"Brasil";11;"LAI MRE";2748
"12";"Doutor";"Marcus Vinicius Pratini de Moraes";"Ministro de Estado de Minas e Energia";NA;"Ministério de Minas e Energia";NA;"Ministro";"UNCED, Conf";"Brasil";12;"LAI MRE";2749
"13";"Doutor";"Affonso Camargo";"Ministro de Estado dos Transporte e das Comunicações";NA;"Ministério dos Transportes e das Comunicações";NA;"Ministro";"UNCED, Conf";"Brasil";13;"LAI MRE";2750
"14";"Doutor";"Reinhold Stephanes";"Ministro de Estado da Previdência Social";NA;"Ministério da Previdência Social";NA;"Ministro";"UNCED, Conf";"Brasil";14;"LAI MRE";2751
"15";"Doutor";"João Mellão Neto";"Ministro de Estado do Trabalho e da Administração";NA;"Ministério do Trabalho e da Administração Federal";NA;"Ministro";"UNCED, Conf";"Brasil";15;"LAI MRE";2752
"16";"Doutor";"Jorge Bornhausen";"Ministro de Estado Chefe da Secretaria de Governo";NA;"Secretaria de Governo da Presidência";NA;"Ministro";"UNCED, Conf";"Brasil";16;"LAI MRE";2753
"17";"Doutor";"Angelo Calmon de Sá";"Ministro de Estado Chefe da Secretaria de Desenvolvimento Regional da Presidência da República e membro da Comissão Interministerial para Preparação da Conferência das Nações Unidas sobre Meio Ambiente e Desenvolvimento – CIMA";NA;"Secretaria de Desenvolvimento Regional da Presidência";NA;"Ministro";"UNCED, Conf";"Brasil";17;"LAI MRE";2754
"18";"Embaixador";"Marcos Antônio de Salvo Coimbra";"Secretário-Geral da Presidência da República";NA;"Secretaria-Geral da Presidência";NA;"Secretário-Geral";"UNCED, Conf";"Brasil";18;"LAI MRE";2755
"19";"General-de-Brigada";"Agenor Francisco Homem de Carvalho";"Chefe do Gabinete Militar da Presidência da República";NA;"Gabinete Militar da Presidência";NA;"Chefe do Gabinete Militar da PR; General-de-Brigada";"UNCED, Conf";"Brasil";19;"LAI MRE";2756
"20";"General-de-Exército";"Antônio Luiz Rocha Veneu";"Chefe do Estado-Maior das Forças Armadas";NA;"Estado-Maior das Forças Armadas";NA;"Chefe do Estado-Maior das FFAA; General-de-Exército";"UNCED, Conf";"Brasil";20;"LAI MRE";2757
"21";"Doutor";"Célio Silva";"Consultor-Geral da República";NA;"Consultoria-Geral da República";NA;"Consultor-Geral";"UNCED, Conf";"Brasil";21;"LAI MRE";2758
"22";"Embaixador";"Sérgio Paulo Rouanet";"Secretário de Cultura da Presidência da República";NA;"Secretaria de Cultura da Presidência";NA;"Secretário";"UNCED, Conf";"Brasil";22;"LAI MRE";2759
"23";"Professor";"Hélio Jaguaribe de Mattos";"Secretário de Ciência e Tecnologia da Presidência da República e membro da Comissão Interministerial para a Preparação da Conferência das Nações Unidas sobre Meio Ambiente e Desenvolvimento – CIMA";NA;"Secretaria de Ciência e Tecnologia da Presidência";NA;"Secretário";"UNCED, Conf";"Brasil";23;"LAI MRE";2760
"24";"Doutor";"Bernard Rajzman";"Secretaria de Desportos da Presidência da República";NA;"Secretaria de Desportos da Presidência";NA;"Secretário";"UNCED, Conf";"Brasil";24;"LAI MRE";2761
"25";"Doutor";"Eliezer Batista da Silva";"Secretário de Assuntos Estratégicos da Presidência da República e membro da Comissão Interministerial para a Preparação da Conferência das Nações Unidas sobre Meio Ambiente e Desenvolvimento – CIMA";NA;"Secretaria de Assuntos Estratégicos da Presidência";NA;"Secretário";"UNCED, Conf";"Brasil";25;"LAI MRE";2762
"26";"Doutor";"Joaquim Domingos Roriz";"Governador do Distrito Federal";NA;"Distrito Federal";NA;"Governador";"UNCED, Conf";"Brasil";26;"LAI MRE";2763
"27";"Doutor";"Antônio Carlos Peixoto Magalhães";"Governador do Estado da Bahia";NA;"Estado da Bahia";NA;"Governador";"UNCED, Conf";"Brasil";27;"LAI MRE";2764
"28";"Engenheiro";"Leonel de Moura Brizola";"Governador do Estado do Rio de Janeiro";NA;"Estado do Rio de Janeiro";NA;"Governador";"UNCED, Conf";"Brasil";28;"LAI MRE";2765
"29";"Doutor";"Edson Lobão";"Governador do Estado do Maranhão";NA;"Estado do Maranhão";NA;"Governador";"UNCED, Conf";"Brasil";29;"LAI MRE";2766
"30";"Doutor";"Jader Fontenelli Barbalho";"Governador do Pará";NA;"Estado do Pará";NA;"Governador";"UNCED, Conf";"Brasil";30;"LAI MRE";2767
"31";"Doutor";"Joaquim Francisco de Freitas Cavalcante";"Governador do Estado de Pernambuco";NA;"Estado de Pernambuco";NA;"Governador";"UNCED, Conf";"Brasil";31;"LAI MRE";2768
"32";"Doutor";"Luiz Antônio Fleury Filho";"Governador do Estado de São Paulo";NA;"Estado de São Paulo";NA;"Governador";"UNCED, Conf";"Brasil";32;"LAI MRE";2769
"33";"Doutor";"Hélio Carvalho Garcia";"Governador do Estado de Minas Gerais";NA;"Estado de Minas Gerais";NA;"Governador";"UNCED, Conf";"Brasil";33;"LAI MRE";2770
"34";"Doutor";"Iris Rezende";"Governador do Estado de Goiás";NA;"Estado de Goiás";NA;"Governador";"UNCED, Conf";"Brasil";34;"LAI MRE";2771
"35";"Doutor";"Jayme Veríssimo de Campos";"Governador do Estado do Mato Grosso";NA;"Estado do Mato Grosso";NA;"Governador";"UNCED, Conf";"Brasil";35;"LAI MRE";2772
"36";"Doutor";"Alceu de Deus Collares";"Governador do Estado do Rio Grande do Sul";NA;"Estado do Rio Grande do Sul";NA;"Governador";"UNCED, Conf";"Brasil";36;"LAI MRE";2773
"37";"Doutor";"Ciro Ferreira Gomes";"Governador do Estado do Ceará";NA;"Estado do Ceará";NA;"Governador";"UNCED, Conf";"Brasil";37;"LAI MRE";2774
"38";"Doutor";"Ronaldo Cunha Lima";"Governador do Estado da Paraíba";NA;"Estado da Paraíba";NA;"Governador";"UNCED, Conf";"Brasil";38;"LAI MRE";2775
"39";"Doutor";"Albuíno Cunha de Azeredo";"Governador do Estado do Espirito Santo";NA;"Estado do Espírito Santo";NA;"Governador";"UNCED, Conf";"Brasil";39;"LAI MRE";2776
"40";"Doutor";"Antonio de Almendra Freitas Neto";"Governador do Estado do Piauí";NA;"Estado do Piauí";NA;"Governador";"UNCED, Conf";"Brasil";40;"LAI MRE";2777
"41";"Doutor";"José Agripino Maia";"Governador do Estado do Rio Grande do Norte";NA;"Estado do Rio Grande do Norte";NA;"Governador";"UNCED, Conf";"Brasil";41;"LAI MRE";2778
"42";"Doutor";"Vilson Pedro Kleinübing";"Governador do Estado de Santa Catarina";NA;"Estado de Santa Catarina";NA;"Governador";"UNCED, Conf";"Brasil";42;"LAI MRE";2779
"43";"Doutor";"Geraldo Bulhões Barros";"Governador do Estado de Alagoas";NA;"Estado de Alagoas";NA;"Governador";"UNCED, Conf";"Brasil";43;"LAI MRE";1279
"44";"Doutor";"João Alves Filho";"Governador do Estado de Sergipe";NA;"Estado de Sergipe";NA;"Governador";"UNCED, Conf";"Brasil";44;"LAI MRE";2780
"45";"Doutor";"Gilberto Mestrinho de Medeiros Raposo";"Governador do Estado do Amazonas";NA;"Estado do Amazonas";NA;"Governador";"UNCED, Conf";"Brasil";45;"LAI MRE";2781
"46";"Doutor";"Roberto Requião de Mello e Silva";"Governador do Estado do Paraná";NA;"Estado do Paraná";NA;"Governador";"UNCED, Conf";"Brasil";46;"LAI MRE";2782
"47";"Doutor";"Romildo Magalhães Silva";"Governador do Estado do Acre";NA;"Estado do Acre";NA;"Governador";"UNCED, Conf";"Brasil";47;"LAI MRE";2783
"48";"Doutor";"Pedro Pedrossian";"Governador do Estado do Mato Grosso do Sul";NA;"Estado do Mato Grosso do Sul";NA;"Governador";"UNCED, Conf";"Brasil";48;"LAI MRE";2784
"49";"Doutor";"Oswaldo Pianna Filho";"Governador do Estado de Rondônia";NA;"Estado de Rondônia";NA;"Governador";"UNCED, Conf";"Brasil";49;"LAI MRE";2785
"50";"Doutor";"Moisés Nogueira Avelino";"Governador do Estado do Tocantins";NA;"Estado do Tocantins";NA;"Governador";"UNCED, Conf";"Brasil";50;"LAI MRE";2786
"51";"Doutor";"Ottomar de Souza Pinto";"Governador do Estado de Roraima";NA;"Estado de Roraima";NA;"Governador";"UNCED, Conf";"Brasil";51;"LAI MRE";2787
"52";"Doutor";"Aníbal Barcellos";"Governador do Estado de Amapá";NA;"Estado de Amapá";NA;"Governador";"UNCED, Conf";"Brasil";52;"LAI MRE";2788
"53";"Doutor";"Fernando César Mesquita";"Secretário do Meio Ambiente e Turismo do Estado do Maranhão";NA;"Estado do Maranhão";"Secretaria do Meio Ambiente e Turismo";"Secretário";"UNCED, Conf";"Brasil";53;"LAI MRE";2789
"54";"Doutor";"Alaor Caffé Alves";"Secretário do Meio Ambiente do Estado de São Paulo";NA;"Estado de São Paulo";"Secretaria do Meio Ambiente";"Secretário";"UNCED, Conf";"Brasil";54;"LAI MRE";2790
"55";"Doutora";"Neusa Canabarro";"Secretária de Educação do Estado do Rio Grande do Sul";NA;"Estado do Rio Grande do Sul";"Secretaria de Educação";"Secretário";"UNCED, Conf";"Brasil";55;"LAI MRE";2791
"56";"Doutora";"Marfisa Maria Aguar Ferreira";"Secretária de Desenvolvimento Urbano e Meio Ambiente do Estado do Ceará";NA;"Estado do Ceará";"Secretaria de Desenvolvimento Urbano e Meio Ambiente";"Secretário";"UNCED, Conf";"Brasil";56;"LAI MRE";2792
"57";"Doutor";"Inaldo Rocha Leitão";"Secretário da Justiça, Cidadania e Meio Ambiente do Estado da Paraíba";NA;"Estado da Paraíba";"Secretaria de Justiça, Cidadania e Meio Ambiente";"Secretário";"UNCED, Conf";"Brasil";57;"LAI MRE";2793
"58";"Doutor";"José Saldanha Fontenelle Filho";"Secretário Extraordinário de Representação do Governo do Estado do Piauí em Brasília";NA;"Estado do Piauí";"Secretaria Extraordinária de Representação do Governo em Brasília";"Secretário";"UNCED, Conf";"Brasil";58;"LAI MRE";2794
"59";"Doutor";"Rogério Kracik Rosa";"Secretário da Tecnologia, Energia e Meio Ambiente do Estado de Santa Catarina";NA;"Estado de Santa Catarina";"Secretaria de Tecnologia, Energia e Meio Ambiente";"Secretário";"UNCED, Conf";"Brasil";59;"LAI MRE";2795
"60";"Doutor";"Francisco José Silveira Pereira";"Secretário do Desenvolvimento Ambiental do Estado de Rondônia";NA;"Estado de Rondônia";"Secretaria do Desenvolvimento Ambiental";"Secretário";"UNCED, Conf";"Brasil";60;"LAI MRE";2796
"61";"Doutor";"Marcello Alencar";"Prefeito da Cidade do Rio de Janeiro";NA;"Cidade do Rio de Janeiro";NA;NA;"UNCED, Conf";"Brasil";61;"LAI MRE";2797
"62";"Senador";"Mauro Benevides";"Presidente do Congresso Nacional";NA;"Senado Federal";NA;"Senador; Presidente do Senado";"UNCED, Conf";"Brasil";62;"LAI MRE";2798
"63";"Deputado";"Ibsen Pinheiro";"Presidente da Câmara dos Deputados";NA;"Câmara dos Deputados";NA;"Deputado; Presidente da Câmara";"UNCED, Conf";"Brasil";63;"LAI MRE";2799
"64";"Embaixador";"Luiz Felipe de Seixas Corrêa";"Secretário-Geral de Política Exterior";NA;"Ministério das Relações Exteriores";"Secretaria-Geral de Política Exterior";"Secretário-Geral";"UNCED, Conf";"Brasil";64;"LAI MRE";2800
"65";"Almirante-de-Esquadra";"Ivan da Silveira Serpa";"Chefe do Estado-Maior da Armada e membro da Comissão lnterministerial para a Preparação da Conferência das Nações Unidas sobre Meio Ambiente e Desenvolvimento CIMA";NA;"Marinha do Brasil";"Estado-Maior da Armada";"Chefe do Estado-Maior da Armada; Almirante-de-Esquadra";"UNCED, Conf";"Brasil";65;"LAI MRE";2801
"66";"General";"Antonio Joaquim Soares Moreira";"Chefe do Estado-Maior do Exército e membro da Comissão Interministerial para a Preparação da Conferência das Nações Unidas sobre o Meio Ambiente e Desenvolvimento - CIMA";NA;"Exército do Brasil";"Estado-Maior do Exército";"Chefe do Estado-Maior do Exército; General";"UNCED, Conf";"Brasil";66;"LAI MRE";2802
"67";"Tenente-Brigadeiro-do-Ar";"Lélio Viana Lôbo";"Chefe do Estado Maior da Aeronáutica e membro da Comissão Interministerial para a Preparação da Conferência das Nações Unidas sobre Meio Ambiente e Desenvolvimento - CIMA";NA;"Força Aérea Brasileira";"Estado-Maior da Aeronáutica";"Chefe do Estado Maior da Aeronáutica; Tenente-Brigadeiro-do-Ar";"UNCED, Conf";"Brasil";67;"LAI MRE";2803
"68";"Ministro";"Carlos Moreira Garcia";"Secretário da Administração Federal e Presidente do Grupo de Trabalho Nacional para a Organização da Conferência das Nações Unidas sobre Meio Ambiente e Desenvolvimento;";NA;NA;NA;NA;"UNCED, Conf";"Brasil";68;"LAI MRE";24
"69";"Embaixador";"Marcos Castrioto de Azambuja";"Representante Especial para Coordenar as Posições Brasileiras à Conferência do Rio";NA;"Ministério das Relações Exteriores";"Representação Especial para Coordenar as Posições Brasileiras à Conferência do Rio";"Representante Especial; Embaixador";"UNCED, Conf";"Brasil";69;"LAI MRE";2804
"70";"Doutor";"Pedro Parente";"Secretário Nacional de Planejamento e membro da Comissão Interministerial para a Preparação da Conferência das Nações sobre Meio Ambiente e Desenvolvimento - CIMA";NA;"Ministério da Economia, Fazenda e Planejamento";"Secretaria Nacional de Planejamento";"Secretário";"UNCED, Conf";"Brasil";70;"LAI MRE";2805
"71";"Doutora";"Dorothea Fonseca Furquim Werneck";"Secretária Nacional da Economia e membro da Comissão Interministerial para a Preparação da Conferência das Nações Unidas sobre Meio Ambiente e Desenvolvimento – CIMA";NA;"Ministério da Economia, Fazenda e Planejamento";"Secretaria Nacional de Economia";"Secretário";"UNCED, Conf";"Brasil";71;"LAI MRE";2806
"72";"Doutor";"Armando Ribeiro de Araújo";"Secretário Nacional de Energia e membro da Comissão Interministerial para a Preparação da Conferência das Nações Unidas sobre Meio Ambiente e Desenvolvimento – CIMA";NA;"Ministério da Infra-Estrutura";"Secretaria Nacional de Energia";"Secretário";"UNCED, Conf";"Brasil";72;"LAI MRE";2807
"73";"Doutor";"Luiz André Rico Vicente";"Secretário Nacional de Minas e Metalurgia e Membro da Comissão Interministerial para a preparação da Conferência das Nações Unidas sobre Meio Ambiente e Desenvolvimento – CIMA";NA;"Ministério da Infra-Estrutura";"Secretaria Nacional de Minas e Metalurgia";"Secretário";"UNCED, Conf";"Brasil";73;"LAI MRE";2808
"74";"Doutor";"João Batista Risi Junior";"Secretário Nacional da Vigilância Sanitária e Membro da Comissão Interministerial para a preparação da Conferência das Nações Unidas sobre Meio Ambiente e Desenvolvimento – CIMA";NA;"Ministério da Saúde";"Secretaria Nacional da Vigilância Sanitária";"Secretário";"UNCED, Conf";"Brasil";74;"LAI MRE";2809
"75";"Doutor";"Paulo Bezerril Junior";"Secretário Nacional de Saneamento e Membro da Comissão Interministerial para a Preparação da Conferência das Nações Unidas sobre Meio Ambiente e Desenvolvimento – CIMA";NA;"Ministério da Ação Social";"Secretaria Nacional de Saneamento";"Secretário";"UNCED, Conf";"Brasil";75;"LAI MRE";2810
"76";"General-de-Exército";"Angelo Barata Filho";"Comandante Militar do Leste";NA;"Exército do Brasil";NA;"Comandante Militar do Leste; General-de-Exército";"UNCED, Conf";"Brasil";76;"LAI MRE";2811
"77";"Embaixador";"Rubens Ricupero";"Embaixador em Washington";NA;"Ministério das Relações Exteriores";"Embaixada em Washington";"Embaixador";"UNCED, Conf";"Brasil";77;"LAI MRE";2812
"78";"Embaixador";"Ronaldo Mota Sardenberg";"Representante Permanente junto às Nações Unidas, em Nova York";NA;"Ministério das Relações Exteriores";"Missão Permanente junto às Nações Unidas em Nova York";"Embaixador; Representante";"UNCED, Conf";"Brasil";78;"LAI MRE";2813
"79";"Embaixador";"Luiz Felipe de La Torre Benitez Teixeira Soares";"Representante Permanente Junto ao Programa das Nações Unidas para o Meio Ambiente (PNUMA), em Nairóbi";NA;"Ministério das Relações Exteriores";"Missão Permanente Junto ao Programa das Nações Unidas para o Meio Ambiente (PNUMA), em Nairóbi";"Embaixador; Representante";"UNCED, Conf";"Brasil";79;"LAI MRE";2814
"80";"Embaixador";"Bernardo Pericás Neto";"Representante junto à Organização dos Estados Americanos (OEA)";NA;"Ministério das Relações Exteriores";"Missão Permanente junto à Organização dos Estados Americanos (OEA)";"Embaixador; Representante";"UNCED, Conf";"Brasil";80;"LAI MRE";2815
"81";"Embaixador";"Luiz Augusto Saint-Brisson de Araújo Castro";"Representante Permanente Adjunto Junto ás Nações Unidas em Nova York";NA;"Ministério das Relações Exteriores";"Missão Permanente junto às Nações Unidas em Nova York";"Embaixador; Representante permanente adjunto";"UNCED, Conf";"Brasil";81;"LAI MRE";2813
"82";"Embaixador";"Celso Luiz Nunes Amorim";"Representante Permanente Junto às Nações Unidas, em Genebra";NA;"Ministério das Relações Exteriores";"Missão Permanente junto às Nações Unidas em Genebra";NA;"UNCED, Conf";"Brasil";82;"LAI MRE";2816
"83";"Embaixador";"José Artur Denot Medeiros";"Diretor do Departamento de Assuntos Internacionais da Secretaria Nacional de Planejamento do Ministério da Economia, Fazenda e Planejamento";NA;"Ministério da Economia, Fazenda e Planejamento";"Departamento de Assuntos Internacionais, Secretaria Nacional de Planejamento";"Diretor";"UNCED, Conf";"Brasil";83;"LAI MRE";2817
"84";"Embaixador";"Oto Agripino Maia";"Subsecretário-Geral da Presidência da República";NA;"Secretaria-Geral da Presidência";NA;"Subsecretário-geral";"UNCED, Conf";"Brasil";84;"LAI MRE";2755
"85";"Embaixador";"Gelson Fonseca Junior";"Assessor-Chefe da Assessoria Diplomática da Presidência da República";NA;"Presidência da República";"Assessoria Diplomática";"Assessor-chefe";"UNCED, Conf";"Brasil";85;"LAI MRE";2818
"86";"Doutor";"Mauro Durante";"Chefe de Gabinete do Vice-Presidente da República";NA;"Vice-Presidência da República";"Gabinete do vice-presidente";"Chefe de gabinete";"UNCED, Conf";"Brasil";86;"LAI MRE";2819
"87";"Embaixador";"Synesio Sampaio Goes Filho";"Chefe de Gabinete do Ministro das Relações Exteriores";NA;"Ministério das Relações Exteriores";"Gabinete do ministro";"Chefe de gabinete do ministro";"UNCED, Conf";"Brasil";87;"LAI MRE";2820
"88";"Embaixador";"Gilberto Vergne Saboia";"Chefe de Gabinete do Secretário-Geral de Política Exterior";NA;"Ministério das Relações Exteriores";"Secretaria-Geral de Política Exterior";"Chefe de gabinete do secretário-geral";"UNCED, Conf";"Brasil";88;"LAI MRE";2800
"89";"Doutor";"José Gregori";"Chefe de Gabinete do Ministro de Estado da Economia, Fazenda e Planejamento;";NA;"Ministério da Economia, Fazenda e Planejamento";"Gabinete do ministro";"Chefe de gabinete do ministro";"UNCED, Conf";"Brasil";89;"LAI MRE";2821
"90";"Ministro";"Flávio Miragaia Perri";"Secretário-Executivo do grupo de Trabalho Nacional para Organização da Conferência das Nações Unidas sobre Meio Ambiente e Desenvolvimento – CIMA";NA;"Ministério das Relações Exteriores";"Grupo de Trabalho Nacional para Organização da Conferência das Nações Unidas sobre Meio Ambiente e Desenvolvimento, CIMA - Comissão Interministerial para a Preparação da Conferência das Nações Unidas sobre Meio Ambiente e Desenvolvimento]";"Secretário-Executivo; Ministro (diplomata)";"UNCED, Conf";"Brasil";90;"LAI MRE";2822
"91";"Ministro";"Luiz Fernando de Oliveira e Cruz Benedini";"Secretário de Imprensa do Ministério das Relações Exteriores";NA;"Ministério das Relações Exteriores";"Secretaria de Imprensa";"Secretário; Ministro (diplomata)";"UNCED, Conf";"Brasil";91;"LAI MRE";2823
"92";"Ministro";"Adhemar Gabriel Bahadian";"da Missão Permanente Junto ás Nações Unidas em Nova York";NA;"Ministério das Relações Exteriores";"Missão Permanente junto às Nações Unidas em Nova York";"Ministro";"UNCED, Conf";"Brasil";92;"LAI MRE";2813
"93";"Ministro";"Luiz Filipe de Macedo Soares";"Chefe da Divisão de Meio Ambiente do Ministério das Relações Exteriores e Secretário-Executivo da Comissão Interministerial, para Preparação da Conferência das Nações Unidas sobre Meio Ambiente e Desenvolvimento – CIMA";NA;"Ministério das Relações Exteriores";"Divisão de Meio Ambiente; CIMA";"Ministro; Chefe de divisão; Secretário-Executivo da CIMA";"UNCED, Conf";"Brasil";93;"LAI MRE";2824
"94";"Ministro";"Roberto Rodrigues Krause";"Assessor para Assuntos Sociais da Secretaria-Geral da Presidência da República";NA;"Secretaria-Geral da Presidência";"Assessoria para Assuntos Sociais";"Assessor";"UNCED, Conf";"Brasil";94;"LAI MRE";2825
"95";"Ministro";"Frederico Cezar de Araújo";"Cônsul-Geral em Londres e Chefe da Comissão de Cerimonial do Grupo de Trabalho Nacional para a Organização da Conferência das Nações Unidas sobre Meio Ambiente e Desenvolvimento - CIMA";NA;"Ministério das Relações Exteriores";"Comissão de Cerimonial do Grupo de Trabalho Nacional para a Organização da Conferência das Nações Unidas sobre Meio Ambiente e Desenvolvimento, CIMA; Consulado-Geral em Londres";"Chefe da comissão; Cônsul-geral; Ministro";"UNCED, Conf";"Brasil";95;"LAI MRE";2826
"96";"Ministro";"Marcus Camacho de Vincenzi";"Chefe da Subchefia Internacional da Vice-Presidência da República";NA;"Vice-Presidência da República";"Subchefia Internacional";"Chefe";"UNCED, Conf";"Brasil";96;"LAI MRE";2827
"97";"Doutor";"Romeu Tuma";"Secretário da Polícia Federal e membro da Comissão Interministerial para a Preparação da Conferência das Nações Unidas sobre Meio Ambiente e Desenvolvimento – CIMA";NA;"Departamento de Polícia Federal";NA;"Secretário";"UNCED, Conf";"Brasil";97;"LAI MRE";2828
"98";"Doutor";"Luiz Fernando Gusmão Wellisch";"Secretário da Fazenda Nacional e Diretor do Departamento da Receita Federal";NA;"Ministério da Economia, Fazenda e Planejamento";"Secretaria da Fazenda Nacional; Departamento da Receita Federal";"Secretário; Diretor";"UNCED, Conf";"Brasil";98;"LAI MRE";2829
"99";"Contra-Almirante";"Roberto Costa Ferrenho";"Secretário da Comissão Interministerial para os Recursos do Mar (SECIRM) e assessor da Comissão Interministerial para a Preparação da Conferência das Nações Unidas sobre Meio Ambiente e Desenvolvimento – CIMA";NA;"Comissão Interministerial para os Recursos do Mar (SECIRM); CIMA";NA;"Contra-Almirante; Secretário da SECIRM; Assessor da CIMA";"UNCED, Conf";"Brasil";99;"LAI MRE";2830
"100";"Doutor";"Herbert Otto Roger Schubart";"da Secretaria de Assuntos Estratégicos da Presidência da República";NA;"Secretaria de Assuntos Estratégicos da Presidência";NA;NA;"UNCED, Conf";"Brasil";100;"LAI MRE";2762
"101";"Doutor";"Luiz Antônio Barreto de Castro";"da Secretária da Ciência e Tecnologia da Presidência da República";NA;"Secretaria de Ciência e Tecnologia da Presidência";NA;NA;"UNCED, Conf";"Brasil";101;"LAI MRE";2760
"102";"Doutora";"Maria Teresa Jorge Pádua";"Presidente do Instituto Brasileiro do Meio Ambiente e dos Recursos Naturais Renovaveis (IBAMA) e assessora da Comissão Interministerial para a Preparação da Conferência das Nações Unidas sobre Meio Ambiente e Desenvolvimento – CIMA";NA;"IBAMA - Instituto Brasileiro do Meio Ambiente e dos Recursos Naturais Renováveis";NA;"Presidente";"UNCED, Conf";"Brasil";102;"LAI MRE";2831
"103";"Doutora";"Tânia Maria Tonelli Munhoz";"Ex-Presidente do Instituto Brasileiro do Meio Ambiente e dos Recursos Naturais Renováveis - IBAMA";NA;"IBAMA - Instituto Brasileiro do Meio Ambiente e dos Recursos Naturais Renováveis";NA;"Ex-presidente";"UNCED, Conf";"Brasil";103;"LAI MRE";2831
"104";"Doutor";"José Márcio de Oliveira Ayres";"Ex-Diretor do Instituto Brasileiro de Meio Ambiente e dos Recursos Naturais Renováveis - IBAMA";NA;"IBAMA - Instituto Brasileiro do Meio Ambiente e dos Recursos Naturais Renováveis";NA;"Ex-diretor";"UNCED, Conf";"Brasil";104;"LAI MRE";2831
"105";"Doutor";"Eurico de Andrade Neves Borba";"Presidente da Fundação Instituto Brasileiro de Geografia e Estatísticas";NA;"Fundação Instituto Brasileiro de Geografia e Estatísticas";NA;"Presidente";"UNCED, Conf";"Brasil";105;"LAI MRE";2832
"106";"Doutor";"Marcos Luiz dos Mares Guia";"Presidente do Conselho Nacional do Desenvolvimento Científico e Tecnológico";NA;"CNPq - Conselho Nacional do Desenvolvimento Científico e Tecnológico";NA;"Presidente";"UNCED, Conf";"Brasil";106;"LAI MRE";2833
